<?xml version="1.0" encoding="UTF-8"?>
<!DOCTYPE portafoglio SYSTEM "../portafoglio.dtd">
<portafoglio valuta="€">
	<informazioni tolleranza="5" ultimoAggiornamento="20251113-11:11:37" commissione="5"/>
	<assets>
		<azione ticker="MSFT" valuta="€">
			<nome>Microsoft</nome>
			<operazioni>
				<operazione>
					<data>20251113-11:40:45</data>
					<quantita>13</quantita>
					<prezzo>0.000000</prezzo>
				</operazione>
			</operazioni>
		</azione>
	</assets>
	<liquidita>
		<totale>300</totale>
	</liquidita>
</portafoglio>
